{
  "blocked_tasks": [],
  "checkpoint_id": "checkpoint-000007",
  "completed_tasks": [
    "collect"
  ],
  "created_at": "2026-10-20T21:11:57Z",
  "created_by": {
    "agent": "IndependentQC",
    "instance": "p18-b",
    "platform": "separate-process",
    "role": "reviewer"
  },
  "event_digest": "2449e816dca2b7e1a83bb6c715703487c9e35397e1c860d42fbcd98f9dbf7537",
  "event_seq": 7,
  "graph_revision": "g0001",
  "integrity_level": "verified",
  "next_eligible_tasks": [],
  "pending_tasks": [],
  "provider_unknown_operations": [],
  "run_id": "run-001",
  "schema_version": "1.0.0",
  "state_revision": 7,
  "sync_status": "local_only",
  "verified_artifacts": [
    {
      "artifact_id": "collect-record",
      "locator": "artifacts/collect.json",
      "revision": "v1",
      "sha256": "3f4dd3cbb612c66f242ede6122ba29c899f56a1375703c3db3cc3c7242a1931a"
    }
  ]
}
