{
  "blocked_tasks": [],
  "checkpoint_id": "checkpoint-000055",
  "completed_tasks": [
    "plan",
    "fanout",
    "synthesis",
    "offer",
    "copy",
    "creative",
    "crm",
    "landing",
    "tracking",
    "prelaunch"
  ],
  "created_at": "2026-10-20T21:05:46Z",
  "created_by": {
    "agent": "AmpgentResearch",
    "instance": "p18-a",
    "platform": "github-actions",
    "role": "producer"
  },
  "event_digest": "2aacf5bcaa9e7a55089452d35ead70ec65002c964bd4ad36ae6b05c363abadff",
  "event_seq": 55,
  "graph_revision": "g0001",
  "integrity_level": "verified",
  "next_eligible_tasks": [
    "launch-permit"
  ],
  "pending_tasks": [
    "launch-permit"
  ],
  "provider_unknown_operations": [],
  "run_id": "run-001",
  "schema_version": "1.0.0",
  "state_revision": 55,
  "sync_status": "local_only",
  "verified_artifacts": [
    {
      "artifact_id": "plan-record",
      "locator": "artifacts/plan.md",
      "revision": "v1",
      "sha256": "892d58c64c352361ec42b03cb1e2f3b2c6b92747d66545e7aee872df1fe7f7e7"
    },
    {
      "artifact_id": "fanout-record",
      "locator": "artifacts/fanout.md",
      "revision": "v1",
      "sha256": "2639c9ce6fc4ce79877c789f6e479aee285f3c59c199a9ff7cf693074f20e22f"
    },
    {
      "artifact_id": "synthesis-record",
      "locator": "artifacts/synthesis.md",
      "revision": "v1",
      "sha256": "fad7b46747e22e483bdfde6de5bfd61ffeb6c128111542eaea7f0e3709c64971"
    },
    {
      "artifact_id": "offer-record",
      "locator": "artifacts/offer.md",
      "revision": "v1",
      "sha256": "98d36f5f17e692aba34a0748adec7028b9ee19c5abcead128017dc259a36418d"
    },
    {
      "artifact_id": "copy-record",
      "locator": "artifacts/copy.md",
      "revision": "v1",
      "sha256": "0b283371515f0b3cb2cf65beafc8b71d302455736ef70845eb13fd21ea1c62d4"
    },
    {
      "artifact_id": "creative-record",
      "locator": "artifacts/creative.png",
      "revision": "v2",
      "sha256": "67be5fbe5f15375aa6090ac4f28e2260c7b1cdfecca2f872d85c7e4014528456"
    },
    {
      "artifact_id": "crm-record",
      "locator": "artifacts/crm.md",
      "revision": "v1",
      "sha256": "d4198353c84d1c1ebf7b78cfd1db4a0026d17d6cde293f33058539bd9bca2ec4"
    },
    {
      "artifact_id": "landing-record",
      "locator": "artifacts/landing.md",
      "revision": "v1",
      "sha256": "17245c909412b853171eb7cd7e1207196614bb97064500380657877c6cc75860"
    },
    {
      "artifact_id": "tracking-record",
      "locator": "artifacts/tracking.md",
      "revision": "v1",
      "sha256": "5626e85661b123e7801c852bb5a73ecd5c7699c06113f7ff807f573e53e3f899"
    },
    {
      "artifact_id": "prelaunch-record",
      "locator": "artifacts/prelaunch.md",
      "revision": "v1",
      "sha256": "2dd1e97e78d46031e3e719462132b35ca869242acd38dcd95785c82965e4c995"
    }
  ]
}
