{
  "blocked_tasks": [],
  "checkpoint_id": "checkpoint-000025",
  "completed_tasks": [
    "plan",
    "fanout",
    "synthesis",
    "offer",
    "copy"
  ],
  "created_at": "2026-10-20T21:09:30Z",
  "created_by": {
    "agent": "AmpgentResearch",
    "instance": "p18-a",
    "platform": "github-actions",
    "role": "producer"
  },
  "event_digest": "9431fc542080a22347560a2a81f721e80c84af36714a5640b4d7c63684118afb",
  "event_seq": 25,
  "graph_revision": "g0001",
  "integrity_level": "verified",
  "next_eligible_tasks": [
    "creative",
    "crm",
    "landing"
  ],
  "pending_tasks": [
    "creative",
    "crm",
    "landing",
    "tracking",
    "prelaunch",
    "launch-permit"
  ],
  "provider_unknown_operations": [],
  "run_id": "run-001",
  "schema_version": "1.0.0",
  "state_revision": 25,
  "sync_status": "local_only",
  "verified_artifacts": [
    {
      "artifact_id": "plan-record",
      "locator": "artifacts/plan.md",
      "revision": "v1",
      "sha256": "892d58c64c352361ec42b03cb1e2f3b2c6b92747d66545e7aee872df1fe7f7e7"
    },
    {
      "artifact_id": "fanout-record",
      "locator": "artifacts/fanout.md",
      "revision": "v1",
      "sha256": "2639c9ce6fc4ce79877c789f6e479aee285f3c59c199a9ff7cf693074f20e22f"
    },
    {
      "artifact_id": "synthesis-record",
      "locator": "artifacts/synthesis.md",
      "revision": "v1",
      "sha256": "047d5416f44a058992dbcdcb65ca759397aec260235f03b721a47cc854be3aba"
    },
    {
      "artifact_id": "offer-record",
      "locator": "artifacts/offer.md",
      "revision": "v1",
      "sha256": "98d36f5f17e692aba34a0748adec7028b9ee19c5abcead128017dc259a36418d"
    },
    {
      "artifact_id": "copy-record",
      "locator": "artifacts/copy.md",
      "revision": "v1",
      "sha256": "0b283371515f0b3cb2cf65beafc8b71d302455736ef70845eb13fd21ea1c62d4"
    }
  ]
}
