{
  "blocked_tasks": [],
  "checkpoint_id": "checkpoint-000015",
  "completed_tasks": [
    "plan",
    "fanout",
    "synthesis"
  ],
  "created_at": "2026-10-20T21:05:45Z",
  "created_by": {
    "agent": "AmpgentResearch",
    "instance": "p18-a",
    "platform": "github-actions",
    "role": "producer"
  },
  "event_digest": "3c7d28e2d79f667f051fb9ea9599fbe6bda166b4141f0732e79b4109af7afe95",
  "event_seq": 15,
  "graph_revision": "g0001",
  "integrity_level": "verified",
  "next_eligible_tasks": [
    "offer"
  ],
  "pending_tasks": [
    "offer",
    "copy",
    "creative",
    "crm",
    "landing",
    "tracking",
    "prelaunch",
    "launch-permit"
  ],
  "provider_unknown_operations": [],
  "run_id": "run-001",
  "schema_version": "1.0.0",
  "state_revision": 15,
  "sync_status": "local_only",
  "verified_artifacts": [
    {
      "artifact_id": "plan-record",
      "locator": "artifacts/plan.md",
      "revision": "v1",
      "sha256": "892d58c64c352361ec42b03cb1e2f3b2c6b92747d66545e7aee872df1fe7f7e7"
    },
    {
      "artifact_id": "fanout-record",
      "locator": "artifacts/fanout.md",
      "revision": "v1",
      "sha256": "2639c9ce6fc4ce79877c789f6e479aee285f3c59c199a9ff7cf693074f20e22f"
    },
    {
      "artifact_id": "synthesis-record",
      "locator": "artifacts/synthesis.md",
      "revision": "v1",
      "sha256": "fad7b46747e22e483bdfde6de5bfd61ffeb6c128111542eaea7f0e3709c64971"
    }
  ]
}
