{
  "blocked_tasks": [],
  "checkpoint_id": "checkpoint-000039",
  "completed_tasks": [
    "plan",
    "fanout",
    "synthesis",
    "offer",
    "copy",
    "crm",
    "landing",
    "tracking"
  ],
  "created_at": "2026-10-20T21:11:58Z",
  "created_by": {
    "agent": "AmpgentResearch",
    "instance": "p18-a",
    "platform": "github-actions",
    "role": "producer"
  },
  "event_digest": "2678a0b8b9ae42c2160b4990499d21c85e48cbd2cfa85572887005b48a6df68e",
  "event_seq": 39,
  "graph_revision": "g0001",
  "integrity_level": "verified",
  "next_eligible_tasks": [
    "creative"
  ],
  "pending_tasks": [
    "creative",
    "prelaunch",
    "launch-permit"
  ],
  "provider_unknown_operations": [],
  "run_id": "run-001",
  "schema_version": "1.0.0",
  "state_revision": 39,
  "sync_status": "local_only",
  "verified_artifacts": [
    {
      "artifact_id": "plan-record",
      "locator": "artifacts/plan.md",
      "revision": "v1",
      "sha256": "892d58c64c352361ec42b03cb1e2f3b2c6b92747d66545e7aee872df1fe7f7e7"
    },
    {
      "artifact_id": "fanout-record",
      "locator": "artifacts/fanout.md",
      "revision": "v1",
      "sha256": "2639c9ce6fc4ce79877c789f6e479aee285f3c59c199a9ff7cf693074f20e22f"
    },
    {
      "artifact_id": "synthesis-record",
      "locator": "artifacts/synthesis.md",
      "revision": "v1",
      "sha256": "e876487bf87e0ad2cc0478cfe5054acc502e6a48ae6ca1e99408d1d50ad3b792"
    },
    {
      "artifact_id": "offer-record",
      "locator": "artifacts/offer.md",
      "revision": "v1",
      "sha256": "98d36f5f17e692aba34a0748adec7028b9ee19c5abcead128017dc259a36418d"
    },
    {
      "artifact_id": "copy-record",
      "locator": "artifacts/copy.md",
      "revision": "v1",
      "sha256": "0b283371515f0b3cb2cf65beafc8b71d302455736ef70845eb13fd21ea1c62d4"
    },
    {
      "artifact_id": "crm-record",
      "locator": "artifacts/crm.md",
      "revision": "v1",
      "sha256": "d4198353c84d1c1ebf7b78cfd1db4a0026d17d6cde293f33058539bd9bca2ec4"
    },
    {
      "artifact_id": "landing-record",
      "locator": "artifacts/landing.md",
      "revision": "v1",
      "sha256": "17245c909412b853171eb7cd7e1207196614bb97064500380657877c6cc75860"
    },
    {
      "artifact_id": "tracking-record",
      "locator": "artifacts/tracking.md",
      "revision": "v1",
      "sha256": "5626e85661b123e7801c852bb5a73ecd5c7699c06113f7ff807f573e53e3f899"
    }
  ]
}
