{
  "blocked_tasks": [],
  "checkpoint_id": "checkpoint-000020",
  "completed_tasks": [
    "plan",
    "fanout",
    "synthesis",
    "offer"
  ],
  "created_at": "2026-10-20T21:11:57Z",
  "created_by": {
    "agent": "AmpgentResearch",
    "instance": "p18-a",
    "platform": "github-actions",
    "role": "producer"
  },
  "event_digest": "e404d5706b4e80a1ebb5817eb9d3ccb2a7e984a1f08bf79d4f5b40db8b3e0673",
  "event_seq": 20,
  "graph_revision": "g0001",
  "integrity_level": "verified",
  "next_eligible_tasks": [
    "copy",
    "crm",
    "landing"
  ],
  "pending_tasks": [
    "copy",
    "creative",
    "crm",
    "landing",
    "tracking",
    "prelaunch",
    "launch-permit"
  ],
  "provider_unknown_operations": [],
  "run_id": "run-001",
  "schema_version": "1.0.0",
  "state_revision": 20,
  "sync_status": "local_only",
  "verified_artifacts": [
    {
      "artifact_id": "plan-record",
      "locator": "artifacts/plan.md",
      "revision": "v1",
      "sha256": "892d58c64c352361ec42b03cb1e2f3b2c6b92747d66545e7aee872df1fe7f7e7"
    },
    {
      "artifact_id": "fanout-record",
      "locator": "artifacts/fanout.md",
      "revision": "v1",
      "sha256": "2639c9ce6fc4ce79877c789f6e479aee285f3c59c199a9ff7cf693074f20e22f"
    },
    {
      "artifact_id": "synthesis-record",
      "locator": "artifacts/synthesis.md",
      "revision": "v1",
      "sha256": "e876487bf87e0ad2cc0478cfe5054acc502e6a48ae6ca1e99408d1d50ad3b792"
    },
    {
      "artifact_id": "offer-record",
      "locator": "artifacts/offer.md",
      "revision": "v1",
      "sha256": "98d36f5f17e692aba34a0748adec7028b9ee19c5abcead128017dc259a36418d"
    }
  ]
}
